{
  "formatVersion": "1.0",
  "scope": "historical-evidence-only",
  "packetId": "legacy-scanner-evidence-nonruntime-a41267a7",
  "distributionCommit": "37261c7693429f5ac9fabbe9c614b5203a107b38",
  "supersedesForStaging": [
    "legacy-scanner-slice-a41267a7",
    "legacy-scanner-evidence-a41267a7"
  ],
  "source": {
    "repository": "TakashiSasaki/scan.moukaeritai.work",
    "commit": "a41267a7d79417706fd8f57b42fa67635a8de3b4"
  },
  "destination": {
    "repository": "TakashiSasaki/scan3",
    "expectedBaselineCommit": "c10f1be62c970cffd0d2c43c965beefdfb2beb37",
    "workspaceCommitVerified": false
  },
  "validation": {
    "zipSha256": "bf9137dc65650474882ce04c7c55f6b42fd01fe28bc15f4b5e3c074c3a55273f",
    "officialSourcePacketValidator": "PASS",
    "exactByteVerification": "PASS"
  },
  "restoredFiles": [
    {
      "sourcePath": "src/components/Scanner.tsx",
      "storedPath": "reconstruction/historical/legacy-scanner/a41267a7/src/components/Scanner.tsx.source",
      "sha256": "7598224bdd2fe7f09a111d38430f8d025dfed3747efdb1dc8b7a41aeb358ec38",
      "sizeBytes": 8562
    },
    {
      "sourcePath": "src/index.css",
      "storedPath": "reconstruction/historical/legacy-scanner/a41267a7/src/index.css",
      "sha256": "0bf091e17be32b5fe05b2330979c527b620890c4214d7e9082e466e651155f58",
      "sizeBytes": 2427
    }
  ],
  "runtime": {
    "adapted": false,
    "imported": false,
    "routeActivated": false,
    "dependenciesInstalled": false,
    "compilerConfigurationChanged": false,
    "firebaseConnectivityAdded": false
  }
}
